Linha de Fornecimento,Id,CNPJ,CPF,Nome,Ativo,Recadastrado,Município,UF,Natureza Jurídica,Porte da Empresa,Ramo do Negócio,Unidade Cadastradora,CNAE,CNAE Secundário,Habilitado a Licitar,Número de inscrição,Data de abertura,Endereço eletrônico,Telefone,Nome empresarial,Nome de fantasia,Natureza jurídica API,CNAE API,Logradouro API,Número API,Complemento API,CEP API,Bairro/Distrito API,Município API,UF API
Desinsetização / Desratização / Dedetização,218322,86540721000100,,APF CULTIVO DE MUDAS LTDA,Sim,,45535: Governador Valadares,MG,2: SOCIEDADE EMPRESÁRIA LIMITADA,2: null,,,210106: CULTIVO DE MUDAS EM VIVEIROS FLORESTAIS,,Sim,86.540.721/0001-00MATRIZ,01/08/1994,CONTABILIDADE@DPSERVICOS.COM,33 32712929 33 32795757,APF CULTIVO DE MUDAS LTDA,,2062 - Sociedade Empresária Limitada,02101 - Produção florestal - florestas plantadas,QUARA TUTOYA,SN,,35001970,PICO DO IBITURUNA,GOVERNADOR VALADARES,MG
Desinsetização / Desratização / Dedetização,514529,04517271000170,,CONTROLE DE PRAGAS URBANAS LTDA,Sim,,45535: Governador Valadares,MG,2: SOCIEDADE EMPRESÁRIA LIMITADA,2: null,,,8122200: IMUNIZAÇÃO E CONTROLE DE PRAGAS URBANAS,,Sim,04.517.271/0001-70MATRIZ,22/06/2001,ADM@BYEBYEPRAGAS.COM,33 32710779,CONTROLE DE PRAGAS URBANAS LTDA,BYE BYE PRAGAS,2062 - Sociedade Empresária Limitada,81222 - Imunização e controle de pragas urbanas,R AMELIO MELGACO,314,,35058590,MARIA EUGENIA,GOVERNADOR VALADARES,MG
Desinsetização / Desratização / Dedetização,618602,24703879000104,,WALLACE SHUASNEGER OLIVEIRA RIBEIRO 08254023603,Sim,,45535: Governador Valadares,MG,1: EMPRESÁRIO (INDIVIDUAL),2: null,,,8122200: IMUNIZAÇÃO E CONTROLE DE PRAGAS URBANAS,,Sim,24.703.879/0001-04MATRIZ,02/05/2016,WALLACEOLIVEIRA@HOTMAIL.COM.BR,33 88861869,WALLACE SHUASNEGER OLIVEIRA RIBEIRO 08254023603,WALLACE IMUNIZACAO DE PRAGAS E PRESTACAO DE SERVICOS,2135 - Empresário (Individual),81222 - Imunização e controle de pragas urbanas,R OITO,49,,35012400,MORADA DO ACAMPAMENTO,GOVERNADOR VALADARES,MG
Desinsetização / Desratização / Dedetização,158911,18375824000101,,CONSERVADORA CANARIO LTDA,Sim,,46256: Ipatinga,MG,2: SOCIEDADE EMPRESÁRIA LIMITADA,2: null,,,7820500: LOCAÇÃO DE MÃO-DE-OBRA TEMPORÁRIA,,Sim,18.375.824/0001-01MATRIZ,10/01/1975,DIRETORIA@CONSERVADORACANARIO.COM.BR,31 36177072,CONSERVADORA CANARIO LTDA,,2062 - Sociedade Empresária Limitada,78205 - Locação de mão-de-obra temporária,AV USIMINAS,43,,35160206,BOM RETIRO,IPATINGA,MG
Desinsetização / Desratização / Dedetização,494690,16567488000173,,DEDETIZADORA E DESENTUPIDORA CHAPECO LTDA,Sim,,46256: Ipatinga,MG,2: SOCIEDADE EMPRESÁRIA LIMITADA,2: null,,,8122200: IMUNIZAÇÃO E CONTROLE DE PRAGAS URBANAS,,Sim,16.567.488/0001-73MATRIZ,25/07/2012,NILDOCARREIRO@YAHOO.COM.BR,31 38248483,DEDETIZADORA E DESENTUPIDORA CHAPECO LTDA,CHAPECO DEDETIZADORA E DESENTUPIDORA,2062 - Sociedade Empresária Limitada,81222 - Imunização e controle de pragas urbanas,R MOEMA,20,BRCAO A,35162096,IGUACU,IPATINGA,MG
Desinsetização / Desratização / Dedetização,897141,06988889000143,,DESINSETIZADORA LIDER LTDA,Sim,,46256: Ipatinga,MG,2: SOCIEDADE EMPRESÁRIA LIMITADA,2: null,,,161001: SERVIÇO DE PULVERIZAÇÃO E CONTROLE DE PRAGAS AGRÍCOLAS,,Sim,06.988.889/0001-43MATRIZ,14/09/2004,SAUDESEMPRAGAS@YAHOO.COM.BR,31 38269135,DESINSETIZADORA LIDER LTDA,LIDER DESINSETIZACOES,2062 - Sociedade Empresária Limitada,01610 - Atividades de apoio à agricultura,R SERGIO CARDOSO,104,CASA,35162219,IDEAL,IPATINGA,MG
